{
  "currency": "GBP",
  "period": {"label": "Last 30 days", "comparisonLabel": "Previous 30 days"},
  "headline": {
    "revenue": {"value": 48216.42, "changePercent": -8.4},
    "orders": {"value": 1284, "changePercent": -2.1},
    "conversionRate": {"value": 2.84, "changePercent": -11.7},
    "averageOrderValue": {"value": 37.55, "changePercent": 6.8}
  },
  "trend": [
    {"day": "2026-07-22", "revenue": 1712.22},
    {"day": "2026-07-23", "revenue": 1644.90},
    {"day": "2026-07-24", "revenue": 1803.31},
    {"day": "2026-07-25", "revenue": 1905.67},
    {"day": "2026-07-26", "revenue": 1742.18},
    {"day": "2026-07-27", "revenue": 1698.73},
    {"day": "2026-07-28", "revenue": 1779.41},
    {"day": "2026-07-29", "revenue": 1814.36},
    {"day": "2026-07-30", "revenue": 1751.44},
    {"day": "2026-07-31", "revenue": 1688.12},
    {"day": "2026-08-01", "revenue": 1729.03},
    {"day": "2026-08-02", "revenue": 1660.42},
    {"day": "2026-08-03", "revenue": 1542.98},
    {"day": "2026-08-04", "revenue": 1477.65},
    {"day": "2026-08-05", "revenue": 1402.37},
    {"day": "2026-08-06", "revenue": 1321.09},
    {"day": "2026-08-07", "revenue": 1299.14},
    {"day": "2026-08-08", "revenue": 1355.88},
    {"day": "2026-08-09", "revenue": 1394.22},
    {"day": "2026-08-10", "revenue": 1410.73},
    {"day": "2026-08-11", "revenue": 1366.19},
    {"day": "2026-08-12", "revenue": 1294.66},
    {"day": "2026-08-13", "revenue": 1240.12},
    {"day": "2026-08-14", "revenue": 1198.90},
    {"day": "2026-08-15", "revenue": 1225.44},
    {"day": "2026-08-16", "revenue": 1268.17},
    {"day": "2026-08-17", "revenue": 1301.83},
    {"day": "2026-08-18", "revenue": 1282.51},
    {"day": "2026-08-19", "revenue": 0},
    {"day": "2026-08-20", "revenue": 1188.04}
  ],
  "segments": {
    "channel": [
      {"name": "Organic Search", "revenue": 18124.12, "changePercent": 3.2},
      {"name": "Paid Social", "revenue": 10448.30, "changePercent": -31.6},
      {"name": "Email", "revenue": 9176.84, "changePercent": 8.1},
      {"name": "Direct", "revenue": 10467.16, "changePercent": -4.7}
    ],
    "device": [
      {"name": "Mobile", "revenue": 31718.92, "conversionRate": 2.31, "changePercent": -13.9},
      {"name": "Desktop", "revenue": 15160.72, "conversionRate": 4.18, "changePercent": 4.1},
      {"name": "Tablet", "revenue": 1336.78, "conversionRate": 1.96, "changePercent": -2.3}
    ]
  },
  "anomalies": [
    {
      "id": "paid-social-conversion-drop",
      "severity": "high",
      "title": "Paid Social conversion fell sharply after the mobile checkout release while traffic stayed broadly stable",
      "summary": "Conversion from Paid Social is down 29% versus the previous period; the decline is concentrated on mobile.",
      "evidence": ["Paid Social revenue -31.6%", "Mobile conversion -13.9%", "Desktop conversion +4.1%"],
      "likelyCause": "Possible mobile checkout regression; requires investigation rather than certainty."
    }
  ],
  "recentEvents": [
    {"timestamp": "2026-08-12T09:30:00+01:00", "type": "release", "label": "Mobile checkout update deployed"},
    {"timestamp": "2026-08-15T12:00:00+01:00", "type": "campaign", "label": "Paid Social creative refresh"}
  ]
}